{
  "name": "harness-anchor",
  "description": "Runtime harness layer for Claude Code: state persistence, scope control, verification gates, C/C++ engineering. Companion to superpowers.",
  "version": "0.6.1",
  "author": {
    "name": "redtropig"
  },
  "license": "MIT",
  "keywords": [
    "harness",
    "agent",
    "state",
    "verification",
    "scope-control",
    "cpp",
    "superpowers",
    "context-engineering"
  ]
}
